Exercise 1:

cyf_hotels=# ALTER TABLE customers ADD COLUMN date_of_birth DATE;
ALTER TABLE
cyf_hotels=# select * from customers;
 id |       name       |           email            |       address        |    city    | postcode | country | date_of_birth 
----+------------------+----------------------------+----------------------+------------+----------+---------+---------------
  1 | John Smith       | j.smith@johnsmith.org      | 11 New Road          | Liverpool  | L10 2AB  | UK      | 
  2 | Sue Jones        | s.jones1234@gmail.com      | 120 Old Street       | London     | N10 3CD  | UK      | 
  3 | Alice Evans      | alice.evans001@hotmail.com | 3 High Road          | Manchester | m13 4ef  | UK      | 
  4 | Mohammed Trungpa | mo.trungpa@hotmail.com     | 25 Blue Road         | Manchester | M25 6GH  | UK      | 
  5 | Steven King      | steve.king123@hotmail.com  | 19 Bed Street        | Newtown    | xy2 3ac  | UK      | 
  6 | Nadia Sethuraman | nadia.sethuraman@mail.com  | 135 Green Street     | Manchester | M10 4BG  | UK      | 
  7 | Melinda Marsh    | mel.marsh-123@gmail.com    | 7 Preston Road       | Oldham     | OL3 5XZ  | UK      | 
  8 | Martín Sommer    | martin.sommer@dfgg.net     | C/ Romero, 33        | Madrid     | 28016    | Spain   | 
  9 | Laurence Lebihan | laurence.lebihan@xmzx.net  | 12, rue des Bouchers | Marseille  | 13008    | France  | 
 10 | Keith Stewart    | keith.stewart@gmail.com    | 84 Town Lane         | Tadworth   | td5 7ng  | UK      | 
(10 rows)

cyf_hotels=# ALTER TABLE customers RENAME COLUMN date_of_birth TO birthdate;
ALTER TABLE
cyf_hotels=# select * from customers;
 id |       name       |           email            |       address        |    city    | postcode | country | birthdate 
----+------------------+----------------------------+----------------------+------------+----------+---------+-----------
  1 | John Smith       | j.smith@johnsmith.org      | 11 New Road          | Liverpool  | L10 2AB  | UK      | 
  2 | Sue Jones        | s.jones1234@gmail.com      | 120 Old Street       | London     | N10 3CD  | UK      | 
  3 | Alice Evans      | alice.evans001@hotmail.com | 3 High Road          | Manchester | m13 4ef  | UK      | 
  4 | Mohammed Trungpa | mo.trungpa@hotmail.com     | 25 Blue Road         | Manchester | M25 6GH  | UK      | 
  5 | Steven King      | steve.king123@hotmail.com  | 19 Bed Street        | Newtown    | xy2 3ac  | UK      | 
  6 | Nadia Sethuraman | nadia.sethuraman@mail.com  | 135 Green Street     | Manchester | M10 4BG  | UK      | 
  7 | Melinda Marsh    | mel.marsh-123@gmail.com    | 7 Preston Road       | Oldham     | OL3 5XZ  | UK      | 
  8 | Martín Sommer    | martin.sommer@dfgg.net     | C/ Romero, 33        | Madrid     | 28016    | Spain   | 
  9 | Laurence Lebihan | laurence.lebihan@xmzx.net  | 12, rue des Bouchers | Marseille  | 13008    | France  | 
 10 | Keith Stewart    | keith.stewart@gmail.com    | 84 Town Lane         | Tadworth   | td5 7ng  | UK      | 
(10 rows)

cyf_hotels=# ALTER TABLE customers DROP COLUMN birthdate;
ALTER TABLE
cyf_hotels=# select * from customers;
 id |       name       |           email            |       address        |    city    | postcode | country 
----+------------------+----------------------------+----------------------+------------+----------+---------
  1 | John Smith       | j.smith@johnsmith.org      | 11 New Road          | Liverpool  | L10 2AB  | UK
  2 | Sue Jones        | s.jones1234@gmail.com      | 120 Old Street       | London     | N10 3CD  | UK
  3 | Alice Evans      | alice.evans001@hotmail.com | 3 High Road          | Manchester | m13 4ef  | UK
  4 | Mohammed Trungpa | mo.trungpa@hotmail.com     | 25 Blue Road         | Manchester | M25 6GH  | UK
  5 | Steven King      | steve.king123@hotmail.com  | 19 Bed Street        | Newtown    | xy2 3ac  | UK
  6 | Nadia Sethuraman | nadia.sethuraman@mail.com  | 135 Green Street     | Manchester | M10 4BG  | UK
  7 | Melinda Marsh    | mel.marsh-123@gmail.com    | 7 Preston Road       | Oldham     | OL3 5XZ  | UK
  8 | Martín Sommer    | martin.sommer@dfgg.net     | C/ Romero, 33        | Madrid     | 28016    | Spain
  9 | Laurence Lebihan | laurence.lebihan@xmzx.net  | 12, rue des Bouchers | Marseille  | 13008    | France
 10 | Keith Stewart    | keith.stewart@gmail.com    | 84 Town Lane         | Tadworth   | td5 7ng  | UK
(10 rows)


Exercise 2:

cyf_hotels=# CREATE TABLE test();
CREATE TABLE
cyf_hotels=# \dt
           List of relations
 Schema |   Name    | Type  |  Owner   
--------+-----------+-------+----------
 public | bookings  | table | postgres
 public | customers | table | postgres
 public | hotels    | table | postgres
 public | test      | table | postgres
(4 rows)

cyf_hotels=# DROP TABLE test;
DROP TABLE
cyf_hotels=# \dt
           List of relations
 Schema |   Name    | Type  |  Owner   
--------+-----------+-------+----------
 public | bookings  | table | postgres
 public | customers | table | postgres
 public | hotels    | table | postgres
(3 rows)

Exercise 3:

cyf_hotels=# UPDATE hotels SET postcode = 'L10XYZ' WHERE name='Elder Lake Hotel';
UPDATE 1
cyf_hotels=# SELECT * FROM hotels;
 id |           name           | rooms | postcode 
----+--------------------------+-------+----------
  1 | Golden Cavern Resort     |    10 | L10ABC
  3 | Pleasant Mountain Hotel  |     7 | ABCDE1
  4 | Azure Crown Resort & Spa |    18 | DGQ127
  5 | Jade Peaks Hotel         |     4 | DGQ127
  6 | Elegant Resort           |    14 | DGQ127
  7 | Cozy Hotel               |    20 | AYD189
  8 | Snowy Echo Motel         |    15 | AYD189
  2 | Elder Lake Hotel         |     5 | L10XYZ
(8 rows)

cyf_hotels=# UPDATE hotels SET rooms = 25 WHERE name='Cozy Hotel';
UPDATE 1
cyf_hotels=# SELECT * FROM hotels;
 id |           name           | rooms | postcode 
----+--------------------------+-------+----------
  1 | Golden Cavern Resort     |    10 | L10ABC
  3 | Pleasant Mountain Hotel  |     7 | ABCDE1
  4 | Azure Crown Resort & Spa |    18 | DGQ127
  5 | Jade Peaks Hotel         |     4 | DGQ127
  6 | Elegant Resort           |    14 | DGQ127
  8 | Snowy Echo Motel         |    15 | AYD189
  2 | Elder Lake Hotel         |     5 | L10XYZ
  7 | Cozy Hotel               |    25 | AYD189
(8 rows)

cyf_hotels=# SELECT * FROM customers;
 id |       name       |           email            |       address        |    city    | postcode | country 
----+------------------+----------------------------+----------------------+------------+----------+---------
  1 | John Smith       | j.smith@johnsmith.org      | 11 New Road          | Liverpool  | L10 2AB  | UK
  2 | Sue Jones        | s.jones1234@gmail.com      | 120 Old Street       | London     | N10 3CD  | UK
  3 | Alice Evans      | alice.evans001@hotmail.com | 3 High Road          | Manchester | m13 4ef  | UK
  4 | Mohammed Trungpa | mo.trungpa@hotmail.com     | 25 Blue Road         | Manchester | M25 6GH  | UK
  5 | Steven King      | steve.king123@hotmail.com  | 19 Bed Street        | Newtown    | xy2 3ac  | UK
  6 | Nadia Sethuraman | nadia.sethuraman@mail.com  | 135 Green Street     | Manchester | M10 4BG  | UK
  7 | Melinda Marsh    | mel.marsh-123@gmail.com    | 7 Preston Road       | Oldham     | OL3 5XZ  | UK
  8 | Martín Sommer    | martin.sommer@dfgg.net     | C/ Romero, 33        | Madrid     | 28016    | Spain
  9 | Laurence Lebihan | laurence.lebihan@xmzx.net  | 12, rue des Bouchers | Marseille  | 13008    | France
 10 | Keith Stewart    | keith.stewart@gmail.com    | 84 Town Lane         | Tadworth   | td5 7ng  | UK
(10 rows)

cyf_hotels=# UPDATE customers SET address = '2 Blue Street', city = 'Glasgow', postcode = 'G11ABC'  WHERE name='Nadia Sethuraman';
UPDATE 1
cyf_hotels=# SELECT * FROM customers;
 id |       name       |           email            |       address        |    city    | postcode | country 
----+------------------+----------------------------+----------------------+------------+----------+---------
  1 | John Smith       | j.smith@johnsmith.org      | 11 New Road          | Liverpool  | L10 2AB  | UK
  2 | Sue Jones        | s.jones1234@gmail.com      | 120 Old Street       | London     | N10 3CD  | UK
  3 | Alice Evans      | alice.evans001@hotmail.com | 3 High Road          | Manchester | m13 4ef  | UK
  4 | Mohammed Trungpa | mo.trungpa@hotmail.com     | 25 Blue Road         | Manchester | M25 6GH  | UK
  5 | Steven King      | steve.king123@hotmail.com  | 19 Bed Street        | Newtown    | xy2 3ac  | UK
  7 | Melinda Marsh    | mel.marsh-123@gmail.com    | 7 Preston Road       | Oldham     | OL3 5XZ  | UK
  8 | Martín Sommer    | martin.sommer@dfgg.net     | C/ Romero, 33        | Madrid     | 28016    | Spain
  9 | Laurence Lebihan | laurence.lebihan@xmzx.net  | 12, rue des Bouchers | Marseille  | 13008    | France
 10 | Keith Stewart    | keith.stewart@gmail.com    | 84 Town Lane         | Tadworth   | td5 7ng  | UK
  6 | Nadia Sethuraman | nadia.sethuraman@mail.com  | 2 Blue Street        | Glasgow    | G11ABC   | UK
(10 rows)

cyf_hotels=# SELECT * FROM bookings;
 id | customer_id | hotel_id | checkin_date | nights 
----+-------------+----------+--------------+--------
  1 |           1 |        1 | 2019-10-01   |      2
  2 |           1 |        1 | 2019-12-10   |      6
  3 |           1 |        3 | 2019-07-20   |      4
  4 |           2 |        3 | 2020-03-10   |      4
  5 |           2 |        5 | 2020-04-01   |      1
  6 |           3 |        1 | 2019-11-01   |      1
  7 |           3 |        2 | 2019-11-23   |      2
  8 |           4 |        8 | 2019-12-23   |      3
  9 |           4 |        2 | 2019-09-16   |      5
 10 |           6 |        5 | 2019-09-14   |      2
 11 |           6 |        6 | 2020-01-14   |      5
 12 |           8 |        4 | 2020-02-01   |      3
 13 |           8 |        5 | 2020-01-03   |      7
 14 |           8 |        8 | 2019-12-25   |      4
(14 rows)

cyf_hotels=# UPDATE bookings SET nights = 5 WHERE customer_id = 1 AND hotel_id = 1;
UPDATE 2
cyf_hotels=# SELECT * FROM bookings;
 id | customer_id | hotel_id | checkin_date | nights 
----+-------------+----------+--------------+--------
  3 |           1 |        3 | 2019-07-20   |      4
  4 |           2 |        3 | 2020-03-10   |      4
  5 |           2 |        5 | 2020-04-01   |      1
  6 |           3 |        1 | 2019-11-01   |      1
  7 |           3 |        2 | 2019-11-23   |      2
  8 |           4 |        8 | 2019-12-23   |      3
  9 |           4 |        2 | 2019-09-16   |      5
 10 |           6 |        5 | 2019-09-14   |      2
 11 |           6 |        6 | 2020-01-14   |      5
 12 |           8 |        4 | 2020-02-01   |      3
 13 |           8 |        5 | 2020-01-03   |      7
 14 |           8 |        8 | 2019-12-25   |      4
  1 |           1 |        1 | 2019-10-01   |      5
  2 |           1 |        1 | 2019-12-10   |      5
(14 rows)

Exercise 4:

cyf_hotels=# DELETE FROM bookings WHERE customer_id = 8 AND checkin_date = '2020-01-03';
DELETE 1
cyf_hotels=# SELECT * FROM bookings;
 id | customer_id | hotel_id | checkin_date | nights 
----+-------------+----------+--------------+--------
  3 |           1 |        3 | 2019-07-20   |      4
  4 |           2 |        3 | 2020-03-10   |      4
  5 |           2 |        5 | 2020-04-01   |      1
  6 |           3 |        1 | 2019-11-01   |      1
  7 |           3 |        2 | 2019-11-23   |      2
  8 |           4 |        8 | 2019-12-23   |      3
  9 |           4 |        2 | 2019-09-16   |      5
 10 |           6 |        5 | 2019-09-14   |      2
 11 |           6 |        6 | 2020-01-14   |      5
 12 |           8 |        4 | 2020-02-01   |      3
 14 |           8 |        8 | 2019-12-25   |      4
  1 |           1 |        1 | 2019-10-01   |      5
  2 |           1 |        1 | 2019-12-10   |      5
(13 rows)


cyf_hotels=# DELETE FROM bookings WHERE customer_id = 6;
DELETE 2
cyf_hotels=# SELECT * FROM bookings;
 id | customer_id | hotel_id | checkin_date | nights 
----+-------------+----------+--------------+--------
  3 |           1 |        3 | 2019-07-20   |      4
  4 |           2 |        3 | 2020-03-10   |      4
  5 |           2 |        5 | 2020-04-01   |      1
  6 |           3 |        1 | 2019-11-01   |      1
  7 |           3 |        2 | 2019-11-23   |      2
  8 |           4 |        8 | 2019-12-23   |      3
  9 |           4 |        2 | 2019-09-16   |      5
 12 |           8 |        4 | 2020-02-01   |      3
 14 |           8 |        8 | 2019-12-25   |      4
  1 |           1 |        1 | 2019-10-01   |      5
  2 |           1 |        1 | 2019-12-10   |      5
(11 rows)

cyf_hotels=# SELECT * FROM customers;
 id |       name       |           email            |       address        |    city    | postcode | country 
----+------------------+----------------------------+----------------------+------------+----------+---------
  1 | John Smith       | j.smith@johnsmith.org      | 11 New Road          | Liverpool  | L10 2AB  | UK
  2 | Sue Jones        | s.jones1234@gmail.com      | 120 Old Street       | London     | N10 3CD  | UK
  3 | Alice Evans      | alice.evans001@hotmail.com | 3 High Road          | Manchester | m13 4ef  | UK
  4 | Mohammed Trungpa | mo.trungpa@hotmail.com     | 25 Blue Road         | Manchester | M25 6GH  | UK
  5 | Steven King      | steve.king123@hotmail.com  | 19 Bed Street        | Newtown    | xy2 3ac  | UK
  7 | Melinda Marsh    | mel.marsh-123@gmail.com    | 7 Preston Road       | Oldham     | OL3 5XZ  | UK
  8 | Martín Sommer    | martin.sommer@dfgg.net     | C/ Romero, 33        | Madrid     | 28016    | Spain
  9 | Laurence Lebihan | laurence.lebihan@xmzx.net  | 12, rue des Bouchers | Marseille  | 13008    | France
 10 | Keith Stewart    | keith.stewart@gmail.com    | 84 Town Lane         | Tadworth   | td5 7ng  | UK
  6 | Nadia Sethuraman | nadia.sethuraman@mail.com  | 2 Blue Street        | Glasgow    | G11ABC   | UK
(10 rows)

cyf_hotels=# DELETE FROM customers WHERE id = 6;
DELETE 1
cyf_hotels=# SELECT * FROM customers;
 id |       name       |           email            |       address        |    city    | postcode | country 
----+------------------+----------------------------+----------------------+------------+----------+---------
  1 | John Smith       | j.smith@johnsmith.org      | 11 New Road          | Liverpool  | L10 2AB  | UK
  2 | Sue Jones        | s.jones1234@gmail.com      | 120 Old Street       | London     | N10 3CD  | UK
  3 | Alice Evans      | alice.evans001@hotmail.com | 3 High Road          | Manchester | m13 4ef  | UK
  4 | Mohammed Trungpa | mo.trungpa@hotmail.com     | 25 Blue Road         | Manchester | M25 6GH  | UK
  5 | Steven King      | steve.king123@hotmail.com  | 19 Bed Street        | Newtown    | xy2 3ac  | UK
  7 | Melinda Marsh    | mel.marsh-123@gmail.com    | 7 Preston Road       | Oldham     | OL3 5XZ  | UK
  8 | Martín Sommer    | martin.sommer@dfgg.net     | C/ Romero, 33        | Madrid     | 28016    | Spain
  9 | Laurence Lebihan | laurence.lebihan@xmzx.net  | 12, rue des Bouchers | Marseille  | 13008    | France
 10 | Keith Stewart    | keith.stewart@gmail.com    | 84 Town Lane         | Tadworth   | td5 7ng  | UK
(9 rows)


Exercise 5:

cyf_hotels=# SELECT * FROM customers INNER JOIN bookings ON customers.id=bookings.customer_id where bookings.checkin_date > '2020-01-01';
 id |     name      |         email          |    address     |  city  | postcode | country | id | customer_id | hotel_id | checkin_date | nights 
----+---------------+------------------------+----------------+--------+----------+---------+----+-------------+----------+--------------+--------
  2 | Sue Jones     | s.jones1234@gmail.com  | 120 Old Street | London | N10 3CD  | UK      |  4 |           2 |        3 | 2020-03-10   |      4
  2 | Sue Jones     | s.jones1234@gmail.com  | 120 Old Street | London | N10 3CD  | UK      |  5 |           2 |        5 | 2020-04-01   |      1
  8 | Martín Sommer | martin.sommer@dfgg.net | C/ Romero, 33  | Madrid | 28016    | Spain   | 12 |           8 |        4 | 2020-02-01   |      3
(3 rows)


cyf_hotels=# SELECT * FROM bookings INNER JOIN customers ON customers.id=bookings.customer_id INNER JOIN hotels ON hotels.id=bookings.hotel_id where hotels.name='Jade Peaks Hotel';
 id | customer_id | hotel_id | checkin_date | nights | id |   name    |         email         |    address     |  city  | postcode | country | id |       name       | rooms | postcode 
----+-------------+----------+--------------+--------+----+-----------+-----------------------+----------------+--------+----------+---------+----+------------------+-------+----------
  5 |           2 |        5 | 2020-04-01   |      1 |  2 | Sue Jones | s.jones1234@gmail.com | 120 Old Street | London | N10 3CD  | UK      |  5 | Jade Peaks Hotel |     4 | DGQ127
(1 row)

cyf_hotels=# SELECT * FROM bookings INNER JOIN customers ON customers.id=bookings.customer_id INNER JOIN hotels ON hotels.id=bookings.hotel_id where hotels.id=5;
 id | customer_id | hotel_id | checkin_date | nights | id |   name    |         email         |    address     |  city  | postcode | country | id |       name       | rooms | postcode 
----+-------------+----------+--------------+--------+----+-----------+-----------------------+----------------+--------+----------+---------+----+------------------+-------+----------
  5 |           2 |        5 | 2020-04-01   |      1 |  2 | Sue Jones | s.jones1234@gmail.com | 120 Old Street | London | N10 3CD  | UK      |  5 | Jade Peaks Hotel |     4 | DGQ127
(1 row)



exercise 6:

cyf_hotels=# SELECT * FROM customers WHERE name LIKE 'S%';
 id |    name     |           email           |    address     |  city   | postcode | country 
----+-------------+---------------------------+----------------+---------+----------+---------
  2 | Sue Jones   | s.jones1234@gmail.com     | 120 Old Street | London  | N10 3CD  | UK
  5 | Steven King | steve.king123@hotmail.com | 19 Bed Street  | Newtown | xy2 3ac  | UK
(2 rows)


cyf_hotels=# SELECT * FROM hotels WHERE name LIKE '%Hotel';
 id |          name           | rooms | postcode 
----+-------------------------+-------+----------
  3 | Pleasant Mountain Hotel |     7 | ABCDE1
  5 | Jade Peaks Hotel        |     4 | DGQ127
  2 | Elder Lake Hotel        |     5 | L10XYZ
  7 | Cozy Hotel              |    25 | AYD189
(4 rows)


cyf_hotels=# SELECT bookings.checkin_date,customers.name,hotels.name FROM bookings
cyf_hotels-# INNER JOIN customers ON customers.id=bookings.customer_id
cyf_hotels-# INNER JOIN hotels ON hotels.id=bookings.hotel_id
cyf_hotels-# ORDER BY bookings.nights DESC LIMIT 5;
 checkin_date |       name       |          name           
--------------+------------------+-------------------------
 2019-12-10   | John Smith       | Golden Cavern Resort
 2019-09-16   | Mohammed Trungpa | Elder Lake Hotel
 2019-10-01   | John Smith       | Golden Cavern Resort
 2019-07-20   | John Smith       | Pleasant Mountain Hotel
 2020-03-10   | Sue Jones        | Pleasant Mountain Hotel
(5 rows)

